customer_id,full_name,gender,date_of_birth,address,city,country,phone_number,email,occupation,education,marital_status
0,Cung Yến N**c,Nữ,1990-11-16,"1412/16/103/191/295w, Trần Hưng Đạo, Phường An Hòa, Thanh Oai, Hà Nội, Việt Nam",Hà Nội,Việt Nam,440-498-7977x6218,vincentjeffrey@example.com,Kỹ sư phần mềm,Đại học,Độc thân
1,Cao Diễm K***h,Nữ,2011-05-04,"1622/57/195t, Trần Hưng Đạo, Phường 8, Đan Phượng, Hồ Chí Minh, Việt Nam",Hồ Chí Minh,Việt Nam,(576)816-1716x97417,jeffrey09@example.com,Công nhân,,Đã kết hôn
2,Trình Linh T***t,Nữ,2002-04-08,"2184/255, Võ Thị Sáu, Phường Bình Trưng Đông, Thạch Thất, Đà Nẵng, Việt Nam",Đà Nẵng,Việt Nam,670.437.5888x389,victoria48@example.com,Nhân viên,Đi làm,Độc thân
3,Hà Thành Q***g,Nam,1998-07-27,"2136/30/168/130/14C, Lê Lai, Phường 9, Gia Lâm, Bình Dương, Việt Nam",Bình Dương,Việt Nam,,collinskeith@example.net,Giám đốc,Tiến sĩ,Có gia đình
4,Lư Tuyến D*y,,2001-08-21,"1837/601, Võ Văn Tần, Phường 9, Quận Tân Phú, Hồ Chí Minh, Việt Nam",Hồ Chí Minh,Việt Nam,204.371.3587,williamscharles@example.com,Giáo viên,Sinh viên,
5,Trần Lan N*m,,,"2524/17/114/3/304, Nguyễn Đình Chiểu, Phường An Cư, Gia Lâm, Tiền Giang, Việt Nam",Tiền Giang,Việt Nam,,kathryn68@example.net,Nhiếp ảnh gia,Đại học,
6,Lưu Trâm Đ**g,Nữ,1991-02-16,"1282/48/169/61/375a, Đường Số 5, Phường Linh Tây, Đông Anh, Cần Thơ, Việt Nam",Cần Thơ,Việt Nam,(569)494-2388x66176,elizabethgarcia@example.org,Lập trình viên,Sinh viên,Có gia đình
7,Vĩnh Đình N**c,Nữ,2001-07-04,"2876/747, Trần Hưng Đạo, Phường Bình Trưng Đông, Phúc Thọ, Hà Nội, Việt Nam",Hà Nội,Việt Nam,001-580-809-0100x048,hendrickswendy@example.com,Kỹ sư phần mềm,Đại học,Có 1 bé
8,Huỳnh Trường H***n,,1989-03-15,"217/32/145/210/64, Trương Định, Phường 10, Đông Anh, Hà Nội, Việt Nam",Hà Nội,Việt Nam,959-637-3599,srowe@example.com,Kỹ sư phần mềm,Trung học phổ thông,Độc thân
9,,Nam,1980-07-18,"866/196, Phố Ngô Quyền, Phường An Lợi Đông, Nam Từ Liêm, Thừa Thiên Huế, Việt Nam",Thừa Thiên Huế,Việt Nam,634-832-8041,xwhite@example.net,,Đại học,Độc thân
10,Huỳnh Gia B*o,Nữ,1996-03-21,"1128/921, Đường Số 6, Phường Linh Đông, Tây Hồ, Hồ Chí Minh, Việt Nam",Hồ Chí Minh,Việt Nam,625-693-3811,,Kiến trúc sư,Đại học,Độc thân
11,Hồ Tuyến Y*n,,1993-10-13,"2407/625, Cô Giang, Phường An Phú, Thanh Xuân, Hồ Chí Minh, Việt Nam",Hồ Chí Minh,Việt Nam,001-980-459-1970,burnschristina@example.com,Bác sĩ,Tiến sĩ,Có gia đình
12,Bùi Yến K**n,,1999-02-08,,Cần Thơ,Việt Nam,(881)810-8154x23764,lambamy@example.net,Giáo viên,Thạc sĩ,Độc thân
13,Lưu Thái Q***h,Nữ,1993-07-10,"2966/30/79/105/117L, Lê Văn Phan, Phường Trường Thọ, Mỹ Đức, Bình Phước, Việt Nam",Bình Phước,Việt Nam,+1-856-405-5759x825,rsantiago@example.net,Designer,Đi làm,Có gia đình
14,Tống Kiên S*n,Nữ,2002-05-11,"560/35/124, Đường Số 9, Phường Trường Thọ, Thanh Trì, Cần Thơ, Việt Nam",Cần Thơ,Việt Nam,467.320.0414,mary63@example.org,Lập trình viên,Thạc sĩ,Độc thân
15,Cung Nguyệt M*,Nữ,2003-12-20,"1837/337, Đồng Khởi, Phường Thủ Thiêm, Quận Gò Vấp, Cần Thơ, Việt Nam",Cần Thơ,Việt Nam,,chad49@example.net,Kỹ sư,Trung học phổ thông,Độc thân
16,Hứa Đình P**c,Nữ,1989-05-25,"703/63/164/134, Lê Văn Phan, Phường Bình An, Phúc Thọ, Đắk Nông, Việt Nam",Đắk Nông,,001-984-276-5111x7605,kristinehunt@example.org,Bác sĩ,Đi làm,
17,Lục Quang Q***h,Nữ,,,Phú Thọ,Việt Nam,,angela32@example.net,,Trung học phổ thông,Có gia đình
18,Dương Vân N****n,Nam,1981-01-24,"1780/888, Điện Biên Phủ, Phường Bình An, Hòa Bình, Hà Nội, Việt Nam",Hà Nội,,(743)703-6367,marc78@example.com,Lập trình viên,Đi làm,Độc thân
19,Cao Yến N**c,Nam,2010-12-05,"1180/8/154/147/26O, Trần Hưng Đạo, Phường Bình An, Thanh Trì, Hải Phòng, Việt Nam",Hải Phòng,Việt Nam,(299)881-7963x71340,james44@example.com,Kỹ sư,Đi làm,Độc thân
20,,Nữ,1993-03-22,"1415/12/36/151, Nguyễn Cư Trinh, Phường 12, Ba Vì, Cần Thơ, Việt Nam",Cần Thơ,Việt Nam,487-433-4140x1065,cheryl91@example.com,Bác sĩ,Sinh viên,Độc thân
21,Bành Oanh D**m,Nam,2001-05-16,"1261/58/64, Đường Số 2, Phường Thảo Điền, Cầu Giấy, Hà Nội, Việt Nam",Hà Nội,Việt Nam,(717)678-1087x59421,craigsullivan@example.org,Kỹ sư phần mềm,Sinh viên,Có gia đình
22,Hạ Thịnh N*a,Nữ,1995-08-19,"635/63/56, Nguyễn Thị Minh Khai, Phường Bình Trưng Đông, Thanh Trì, Hà Nội, Việt Nam",Hà Nội,,,colondustin@example.com,Kỹ sư phần mềm,Sinh viên,Độc thân
23,Võ Hưng T**m,Nam,1995-03-05,"2526/439, Lê Thị Riêng, Phường Bình Trưng Tây, Hà Đông, Bắc Giang, Việt Nam",Bắc Giang,Việt Nam,558.749.4384x40509,williamskyle@example.com,Giáo viên,,Ly hôn
24,Trịnh Nguyên N**t,,1998-09-30,"1345/155, Nguyễn Thị Minh Khai, Phường Tam Phú, Quận 6, Cần Thơ, Việt Nam",Cần Thơ,Việt Nam,001-933-915-3250x83754,ckemp@example.com,Kỹ sư,,Độc thân
25,,Nam,1996-06-11,"1742/64/115, Trương Đăng Quế, Phường Bình Trưng Đông, Hà Đông, Đà Nẵng, Việt Nam",Đà Nẵng,Việt Nam,,simpsondaniel@example.net,Đầu bếp,Sinh viên,Có 1 bé
26,Huỳnh Hải M*,Nữ,2000-08-28,"1649/34/118/285/317e, Điện Biên Phủ, Phường 5, Đống Đa, Hồ Chí Minh, Việt Nam",Hồ Chí Minh,Việt Nam,(925)771-9317x8149,andersonronald@example.com,,Sinh viên,Độc thân
27,Vương Tuyến N****n,Nữ,2000-08-05,"81/43/33, Nguyễn Thị Minh Khai, Phường Linh Xuân, Đan Phượng, Bến Tre, Việt Nam",Bến Tre,Việt Nam,331-473-1884,afrey@example.net,Bác sĩ,Trung học phổ thông,Có 1 bé
28,Mục Hạnh N*a,Nam,,"2694/62/28, Đường Hùng Vương, Phường Thảo Điền, Hoàn Kiếm, Hà Nội, Việt Nam",Hà Nội,Việt Nam,,halljennifer@example.com,Lập trình viên,Đại học,Độc thân
29,,Nữ,1979-11-03,"2265/81/121/159C, Lê Văn Sỹ, Phường Bình Trưng Đông, Đan Phượng, Sơn La, Việt Nam",Sơn La,,965-694-6371x0558,gpena@example.org,Kỹ sư phần mềm,Đại học,Độc thân
30,Thái Đình T***h,Nữ,2012-05-23,"2736/91/199/274/354, Lê Lai, Phường Bình Trưng Tây, Đan Phượng, Hồ Chí Minh, Việt Nam",Hồ Chí Minh,Việt Nam,(775)249-2394,tylercruz@example.com,Nhiếp ảnh gia,Trung học phổ thông,Độc thân
31,Cao Văn L**h,Nam,1995-01-15,"2277/32/158P, Lê Thánh Tôn, Phường Bình Trưng Đông, Quận 2, Đà Nẵng, Việt Nam",Đà Nẵng,Việt Nam,888.831.6509x036,marvin27@example.com,Nhiếp ảnh gia,Thạc sĩ,Độc thân
32,Khuất Quyên T**ý,Nam,1967-01-23,"339/98/46/205, Lê Đức Thọ, Phường Linh Chiểu, Gia Lâm, Hồ Chí Minh, Việt Nam",Hồ Chí Minh,Việt Nam,397-321-7705,katelyn14@example.org,Lập trình viên,,Độc thân
33,Hạ Thành Đ**h,Nữ,2002-08-09,"1931/61/163/287/112, Nhiêu Tứ, Phường 3, Quận 12, Cần Thơ, Việt Nam",Cần Thơ,Việt Nam,(631)665-6277x48611,lwhite@example.com,Nhân viên,Trung học phổ thông,
34,Cao Văn Đ**h,Nam,1999-08-18,"2644/85/166/150/79, Phan Văn Hân, Phường 7, Đống Đa, Cần Thơ, Việt Nam",Cần Thơ,,+1-822-647-5846x149,anthony20@example.org,Diễn viên,Trung học phổ thông,Độc thân
35,Hạ Gia T**g,Nữ,2011-03-04,"2323/784, Đường Số 6, Phường Thủ Thiêm, Đan Phượng, Đà Nẵng, Việt Nam",Đà Nẵng,Việt Nam,(768)452-1477x54951,dawnperez@example.org,Kỹ sư,Sinh viên,Ly hôn
36,Cao Hữu N**c,Nữ,1998-12-11,"1540/731, Trần Hưng Đạo, Phường An Lợi Đông, Quận Bình Thạnh, Nghệ An, Việt Nam",Nghệ An,Việt Nam,785.427.6840x329,,Diễn viên,Sinh viên,Độc thân
37,Huỳnh Đạt B*o,,1983-09-03,"175/646, Cách Mạng Tháng Tám, Phường Thảo Điền, Quận 3, Hồ Chí Minh, Việt Nam",Hồ Chí Minh,,(575)305-1374x37114,caincaitlin@example.net,Công nhân,,Có 2 bé
38,Hoàng Mỹ D**m,Nữ,2011-02-18,"2161/51/92/69, Điện Biên Phủ, Phường An Lạc, Hòa Bình, Đắk Nông, Việt Nam",Đắk Nông,Việt Nam,914-587-6247x4367,normanrebecca@example.net,Ca sĩ,Đi làm,Đã kết hôn
39,Điền Duy Đ**g,Nam,1994-07-11,"2098/47/137/52/255, Cống Lở, Phường 11, Hoàn Kiếm, Hà Nội, Việt Nam",Hà Nội,Việt Nam,563.809.9235,lorrainebradford@example.com,Lập trình viên,Trung học phổ thông,Độc thân
40,Vũ Tuấn Đ*c,Nam,2010-08-23,"331/3/133, Hai Bà Trưng, Phường 4, Phúc Thọ, Hồ Chí Minh, Việt Nam",Hồ Chí Minh,,+1-369-709-3754x27701,hannahburns@example.com,,Trung học phổ thông,Độc thân
41,Lương Sơn N*a,Nữ,2004-04-15,"351/10/51/40/21, Cô Bắc, Phường 3, Phú Thọ, Bình Thuận, Việt Nam",Bình Thuận,,001-603-961-0408x2184,fisherjamie@example.org,Giáo viên,Trung học phổ thông,Độc thân
42,Huỳnh Hậu T***h,Nữ,2012-06-17,"1545/84/49, Hai Bà Trưng, Phường Bình Trưng Đông, Nam Từ Liêm, Hà Nội, Việt Nam",Hà Nội,Việt Nam,708-545-3757x4180,elizabeth32@example.com,,Thạc sĩ,Có gia đình
43,Lục Văn Q***h,Nam,2001-02-27,,Hà Nội,Việt Nam,414-666-3307x91990,jacqueline83@example.com,Lập trình viên,Sinh viên,Đã kết hôn
44,Đoàn Thái A*h,Nam,2000-03-17,"1249/19/16/83o, Cách Mạng Tháng Tám, Phường An Khánh, Gia Lâm, Hà Nội, Việt Nam",Hà Nội,Việt Nam,427-670-9266x25618,ylane@example.com,Đầu bếp,,Độc thân
45,Hà Tiến T**i,Nữ,1995-07-14,"1797/28/164/208f, Đường Hùng Vương, Phường An Cư, Quận Tân Bình, Bình Dương, Việt Nam",Bình Dương,Việt Nam,+1-447-918-5193x158,rturner@example.net,,,Độc thân
46,Khuất Thái Q***h,Nam,,"2225/595, Cô Giang, Phường Tam Bình, Thạch Thất, Bình Dương, Việt Nam",Bình Dương,Việt Nam,5287942475,lgarcia@example.com,Nhân viên phục vụ khách hàng,Sinh viên,Độc thân
47,Ngụy Kiên T**m,,1990-04-10,"2103/42/4/41, Phan Đăng Lưu, Phường Thủ Thiêm, Thanh Oai, Hải Phòng, Việt Nam",Hải Phòng,Việt Nam,248.345.1167,james23@example.net,Công nhân,,Độc thân
48,La Thắng T**g,Nữ,1994-05-16,"999/57/39/235, Lê Văn Phan, Phường An Lạc, Thanh Trì, Hồ Chí Minh, Việt Nam",Hồ Chí Minh,Việt Nam,001-713-825-9208,harrisbrian@example.net,Kỹ sư phần mềm,Đi làm,Độc thân
49,,Nam,1992-07-10,"2119/58/116/27/231, Trần Quang Khải, Phường Thủ Thiêm, Cầu Giấy, Hồ Chí Minh, Việt Nam",Hồ Chí Minh,Việt Nam,486-423-4270x5453,kimberly61@example.net,Lập trình viên,Đi làm,Có gia đình
50,Bình Phong T***h,Nữ,1993-05-27,"2158/90/144, Hoàng Văn Thụ, Phường Bình Trưng Tây, Thanh Xuân, Hải Phòng, Việt Nam",,,339.539.3654,jensenmathew@example.org,Lập trình viên,Trung học phổ thông,Độc thân
51,Tiêu Huyền N*m,Nữ,2011-11-08,"764/1/168/124/151Z, Đường Võ Văn C, Phường 1, Long Biên, Cần Thơ, Việt Nam",Cần Thơ,Việt Nam,(446)946-0279x36186,,Nhân viên hỗ trợ kỹ thuật,,Độc thân
52,Lý Hồng M**h,Nữ,1990-07-05,,Thái Bình,Việt Nam,(500)366-1465,stevenlewis@example.org,Kỹ sư phần mềm,Không có,Độc thân
53,Quách Lâm Đ**h,Nữ,1991-10-03,"855/56/46, Hai Bà Trưng, Phường An Lạc, Quận 3, Yên Bái, Việt Nam",Yên Bái,,5054743293,angelaharris@example.org,Nhiếp ảnh gia,Trung học phổ thông,Đã kết hôn
54,Cù Trâm O**h,Nam,1998-05-22,"1207/467, Đặng Văn Ngữ, Phường Bình Trưng Tây, Thạch Thất, Phú Thọ, Việt Nam",Phú Thọ,Việt Nam,3418571165,jonesmegan@example.com,Kiến trúc sư,Đại học,Độc thân
55,Bùi Quang H*u,Nữ,1998-01-28,"1712/33/45/109, Hồ Văn Huê, Phường 8, Hoàng Mai, Hà Nội, Việt Nam",Hà Nội,Việt Nam,967.745.4459,johnsannette@example.net,Giáo viên,Đại học,Có 1 bé
56,Kỷ Thành Q**n,,1989-06-16,"563/14/13/203, Phố Lý Thường Kiệt, Phường An Khánh, Quận Gò Vấp, Hồ Chí Minh, Việt Nam",Hồ Chí Minh,Việt Nam,525-203-9833x97772,,Kỹ sư phần mềm,Đi làm,Đã kết hôn
57,Nghiêm Ngọc Q***g,Nữ,,"2094/764, Đường Số 10, Phường Bình An, Đông Anh, Đà Nẵng, Việt Nam",Đà Nẵng,,001-855-210-1403,jerrymurphy@example.net,Nhân viên,Đại học,Độc thân
58,Mạc Đan N**c,Nam,2000-10-01,,,Việt Nam,+1-679-621-7884x1696,davidfrazier@example.net,Kỹ sư phần mềm,Đi làm,Độc thân
59,Lỗ Văn H**g,Nữ,1983-03-01,"1092/38/76D, Lý Văn Phức, Phường Thủ Thiêm, Thanh Trì, Bình Dương, Việt Nam",Bình Dương,Việt Nam,001-335-634-7060,,Kỹ sư phần mềm,Đại học,Độc thân
60,Bùi Tùng N**t,Nữ,2002-12-21,"2610/461, Nguyễn Đình Chiểu, Phường 2, Quốc Oai, Bình Phước, Việt Nam",Bình Phước,Việt Nam,,,Biên tập viên,Đi làm,Có 2 bé
61,Châu Đức H**g,Nữ,2003-03-14,"2457/67/187/91, Đồng Khởi, Phường An Lạc, Bắc Từ Liêm, Hồ Chí Minh, Việt Nam",Hồ Chí Minh,Việt Nam,(444)626-1592x754,jason52@example.com,Xây dựng,Không có,Độc thân
62,Pho Thành T*,Nữ,2000-09-01,"711/100/9/167/258d, Hồ Tùng Mậu, Phường Trường Thọ, Chương Mỹ, Đồng Tháp, Việt Nam",,Việt Nam,,williamklein@example.org,Nhân viên,Không có,
63,Vương Tâm X**n,Nữ,2002-12-18,,Đà Nẵng,Việt Nam,001-770-389-3275x1972,mpearson@example.net,Kỹ sư,Thạc sĩ,
64,Khuất Phương N**n,Nữ,2004-07-19,"2678/18/129/258/317d, Trương Quyền, Phường 3, Đống Đa, Quảng Ngãi, Việt Nam",Quảng Ngãi,Việt Nam,,espinozajesus@example.net,Kỹ sư,Trung học phổ thông,Độc thân
65,Lý Hà T*,,2010-08-30,"2493/811, Đường Bạch Đằng, Phường 1, Hòa Bình, Hồ Chí Minh, Việt Nam",Hồ Chí Minh,Việt Nam,685-945-6769x12762,michael78@example.net,Nhân viên,Sinh viên,Có 2 bé
66,Cù Trường Đ*c,Nữ,1991-04-26,"2477/78/171, Phố Nguyễn Thị B, Phường Linh Tây, Quận 2, Hà Nội, Việt Nam",Hà Nội,,(824)945-4371x34667,rritter@example.org,Bác sĩ,Thạc sĩ,Ly hôn
67,Lương Huyền T*,Nữ,1987-12-14,"428/60/117/256/366S, Đường Số 8, Phường Linh Chiểu, Hoài Đức, Quảng Nam, Việt Nam",Quảng Nam,Việt Nam,,ggarcia@example.net,,Sinh viên,Độc thân
68,Trương Quang H*a,Nữ,2008-03-26,"615/61/191/276/365l, Đường Bạch Đằng, Phường Bình Trưng Tây, Quận Phú Nhuận, Hải Phòng, Việt Nam",Hải Phòng,Việt Nam,720.388.8739x086,parkerlisa@example.net,Giáo viên,Không có,Đã kết hôn
69,Lỗ Tâm T****g,Nam,1994-09-12,"2655/90/141/10, Đường Võ Văn C, Phường 2, Ba Đình, Hồ Chí Minh, Việt Nam",Hồ Chí Minh,Việt Nam,272.816.2870x145,wandahess@example.com,Designer,Đại học,Độc thân
70,Lục Minh Q***n,Nữ,2002-02-04,"1006/94/195, Trần Huy Liệu, Phường Linh Trung, Hoàng Mai, Cần Thơ, Việt Nam",Cần Thơ,Việt Nam,001-794-875-7642x507,agutierrez@example.org,Lập trình viên,Sinh viên,Độc thân
71,Sơn Tuyến T***h,Nam,1992-12-31,"2682/57/4X, Trần Hưng Đạo, Phường An Phú, Quận 7, Bình Dương, Việt Nam",Bình Dương,,001-819-223-5287x503,robertquinn@example.com,Diễn viên,Trung học phổ thông,Ly hôn
72,Huỳnh Đức H***g,Nam,2001-01-14,"620/76/134/110, Đặng Tất, Phường Thảo Điền, Sóc Sơn, Điện Biên, Việt Nam",Điện Biên,Việt Nam,001-278-423-4919,monica08@example.net,Xây dựng,Đại học,Độc thân
73,Đỗ Bảo T*m,Nữ,1987-05-12,"899/18/125/79, Điện Biên Phủ, Phường An Lạc, Quận Thủ Đức, Long An, Việt Nam",Long An,Việt Nam,9913577780,nathanstewart@example.com,Lập trình viên,,Độc thân
74,Lâm Tùng Đ*n,Nam,2004-02-03,"411/739, Hồ Hảo Hớn, Phường Linh Trung, Hoài Đức, Đà Nẵng, Việt Nam",Đà Nẵng,Việt Nam,,,Bác sĩ,Đại học,Có gia đình
75,Sơn Trung T**n,Nam,1995-07-24,"433/47/128/145, Lê Văn Phan, Phường Bình Trưng Đông, Quận 10, Hà Nội, Việt Nam",Hà Nội,Việt Nam,+1-512-271-8849x19835,meghanbeltran@example.org,Kỹ sư,Đại học,Độc thân
76,Phó Tùng N**c,Nữ,1993-07-03,"1169/253, Hai Triều, Phường 2, Quận Tân Bình, Đà Nẵng, Việt Nam",,Việt Nam,906-609-3115,roberto39@example.com,Kỹ sư,Đại học,Tái hôn
77,Lâm Hòa H*a,Nữ,1994-09-25,"2160/504, Phó Đức Chính, Phường Bình An, Quận Gò Vấp, Hà Nội, Việt Nam",Hà Nội,Việt Nam,,kthomas@example.com,Lập trình viên,,Đã kết hôn
78,La Diễm Q***g,Nam,,"2216/79/59/149, Điện Biên Phủ, Phường Linh Trung, Đông Anh, Phú Thọ, Việt Nam",Phú Thọ,Việt Nam,+1-222-674-4701x41799,antoniomccoy@example.com,Kiến trúc sư,Sinh viên,Đã kết hôn
79,Đinh Phúc Đ**h,Nam,2006-04-03,"1732/744, Đường Số 9, Phường Bình Trưng Đông, Quận Thủ Đức, Hà Nội, Việt Nam",,Việt Nam,001-785-597-3844x8488,deborah85@example.com,,Tiến sĩ,Độc thân
80,Đông Lâm H**g,Nữ,1989-06-08,"2824/24/188/155, Đường Số 4, Phường An Hòa, Gia Lâm, Đồng Nai, Việt Nam",,Việt Nam,+1-773-733-4139x9689,glarsen@example.org,Bác sĩ,Trung học phổ thông,Đã kết hôn
81,,Nữ,2003-01-04,"2074/54/145, Lê Văn Phan, Phường Tam Bình, Quận 3, Đà Nẵng, Việt Nam",Đà Nẵng,Việt Nam,(392)996-7992x29492,brownmeredith@example.com,Nhân viên,Thạc sĩ,Có gia đình
82,Cù Trâm O**h,Nữ,1994-03-29,"877/505, Lê Lợi, Phường 3, Quận 8, Cần Thơ, Việt Nam",Cần Thơ,,001-523-502-3074x457,stephanie42@example.net,Lập trình viên,,Có gia đình
83,Đỗ Hữu H*a,,1999-08-15,"1125/50/151, Lê Thánh Tôn, Phường An Phú Đông, Sóc Sơn, Hà Nội, Việt Nam",Hà Nội,,001-583-356-4761x791,christinarodgers@example.org,Bác sĩ,Sinh viên,Độc thân
84,Uông Tiến N****t,Nam,1995-03-23,"1181/93/5/248I, Đặng Tất, Phường An Khánh, Đông Anh, Cần Thơ, Việt Nam",Cần Thơ,Việt Nam,406.551.5618,johnnymorales@example.com,Kỹ sư,Sinh viên,Đã kết hôn
85,Bành Thành N**c,Nam,,"429/87/10/23b, Đường Số 9, Phường Linh Trung, Quận 5, Hồ Chí Minh, Việt Nam",Hồ Chí Minh,Việt Nam,475.442.6784x3624,sharon19@example.com,Giám đốc,Sinh viên,Đã kết hôn
86,Đới Hiền D*y,,1996-10-31,"2776/57/94/185, Bùi Hữu Nghĩa, Phường Linh Chiểu, Quận 4, Cà Mau, Việt Nam",Cà Mau,Việt Nam,,davilaamy@example.com,Đầu bếp,Sinh viên,Độc thân
87,Phú Quang T**g,Nữ,1999-07-13,"2248/965, Phố Trịnh Đình C, Phường Linh Xuân, Quận 4, Quảng Bình, Việt Nam",Quảng Bình,Việt Nam,3742093206,,,Đi làm,Đã kết hôn
88,Lâm Nguyên P****g,,,"2989/23/1/218, Hoàng Sa, Phường 12, Quận Gò Vấp, Hà Nội, Việt Nam",Hà Nội,Việt Nam,(295)221-7710x47309,daniellegriffin@example.com,Kỹ sư,Sinh viên,Độc thân
89,Nghiêm Minh H*i,Nữ,2003-11-24,"903/33/139/47, Hai Bà Trưng, Phường 11, Quận Gò Vấp, Hồ Chí Minh, Việt Nam",Hồ Chí Minh,,(247)743-5913x3899,sanchezdavid@example.net,Kỹ sư phần mềm,,Độc thân
90,Đông Thanh L**h,Nữ,1988-07-19,"2907/69/2t, Đường Số 10, Phường Tam Phú, Nam Từ Liêm, Hà Nội, Việt Nam",Hà Nội,Việt Nam,803-695-7384x720,kimberlykoch@example.net,Kỹ sư phần mềm,Sinh viên,Có gia đình
91,Mạc Như H**g,Nam,1991-12-21,"1187/160, Nhiêu Tứ, Phường Linh Xuân, Hoàng Mai, Hồ Chí Minh, Việt Nam",Hồ Chí Minh,,+1-888-838-0296x18366,isosa@example.org,Đầu bếp,Đại học,Độc thân
92,Đồng Vân H*a,Nữ,1999-12-16,"1551/93/177t, Huỳnh Thúc Kháng, Phường Thảo Điền, Quận Tân Phú, Hồ Chí Minh, Việt Nam",,Việt Nam,599-717-0896x985,sharon74@example.net,Lập trình viên,Trung học phổ thông,Có 1 bé
93,Đỗ Thanh N**t,Nam,,"187/98/71/163, Võ Thị Sáu, Phường 1, Đông Anh, Hà Nội, Việt Nam",Hà Nội,Việt Nam,907-760-7109x26189,aruiz@example.org,Lập trình viên,Đi làm,
94,,Nam,,"1081/316, Vĩnh Viễn, Phường 1, Quận 9, Hà Nội, Việt Nam",,Việt Nam,,shelby65@example.net,Người mẫu,Thạc sĩ,Độc thân
95,Sử Đan Đ*n,Nam,1988-07-29,"770/83/60, Nguyễn Đức Cảnh, Phường Tam Phú, Bắc Từ Liêm, Hà Nội, Việt Nam",Hà Nội,Việt Nam,+1-951-799-8801x9768,david03@example.net,Bác sĩ,Đại học,Có gia đình
96,Mạnh Hậu H**n,Nam,1994-08-11,"2368/75/92/241E, Phố Lý Thường Kiệt, Phường 2, Đống Đa, Hải Phòng, Việt Nam",Hải Phòng,Việt Nam,001-749-299-9048x165,andrewmedina@example.org,Nhân viên,Đi làm,Độc thân
97,Trần Đức D**m,Nữ,1995-05-06,"2407/625, Cô Giang, Phường An Phú, Thanh Xuân, Hồ Chí Minh, Việt Nam",Hồ Chí Minh,Việt Nam,(862)784-1173x8054,qmitchell@example.net,Biên tập viên,Sinh viên,Độc thân
98,Phó Công T***h,Nữ,1997-05-07,,Tây Ninh,,001-327-269-8218x4876,jamescarlos@example.net,Kỹ sư phần mềm,Đại học,Có 1 bé
99,Phú Khánh N*a,Nam,1993-12-08,"2171/18/178/98/269, Đường Số 8, Phường Linh Đông, Hòa Bình, Bà Rịa - Vũng Tàu, Việt Nam",Bà Rịa - Vũng Tàu,Việt Nam,(831)981-9866x8567,hartkristen@example.net,Kỹ sư phần mềm,Sinh viên,Độc thân
